[
  {"id": "multi-second-fastest", "tags": ["multi-turn", "arithmetic"], "question": "And the second fastest?", "scenario": 0, "history": [["Which path is fastest?", "Path C, 5.4 min [3]."]], "expect": {"first": ["path-0-A", "path-0-B", "path-0-C"], "answer_contains": ["A", "6.0"]}},
  {"id": "multi-battery-follow-up", "tags": ["multi-turn"], "question": "And what does it do when it gets low?", "scenario": null, "history": [["How does the robot manage its battery?", "It monitors energy and optimises consumption [1]."]], "expect": {"retrieved": ["manual-1"]}},
  {"id": "multi-fog-cross-check", "tags": ["multi-turn"], "question": "What does it compare it against?", "scenario": null, "history": [["Can the LIDAR be wrong in fog?", "Yes, LIDAR data can be unreliable in fog [1]."]], "expect": {"retrieved": ["manual-16"], "answer_contains": ["IMU"]}, "xfail": "retrieval ignores history; elliptic follow-up finds nothing"},
  {"id": "multi-explain-computation", "tags": ["multi-turn", "corrections"], "question": "How did you compute that?", "scenario": 0, "history": [["Which paths should I take to win the race?", "C then A [3][1]."]], "expect": {"retrieved": ["correction-correction_2"]}},
  {"id": "multi-scenario-switch", "tags": ["multi-turn", "pinning", "arithmetic"], "question": "Same question for the winter scenario.", "scenario": 2, "history": [["Which path is fastest?", "Path C, 5.4 min [3]."]], "expect": {"first": ["path-2-P", "path-2-Q", "path-2-R"], "not_retrieved": ["path-0-C"], "answer_contains": ["Q", "6.0"]}, "xfail": "search hits are not filtered by scenario: other scenario's steps leak in"}
]
