[
  {"id": "fact-pinned-for-its-scenario", "tags": ["facts", "pinning"], "facts": [{"text": "Path B has a new fallen tree across it.", "scenario": 0}], "question": "What is on path B today?", "scenario": 0, "expect": {"first": ["data/paths.json#0/A", "data/paths.json#0/B", "data/paths.json#0/C", "fact-0"], "answer_contains": ["tree"]}},
  {"id": "fact-other-scenario-not-pinned", "tags": ["facts", "pinning"], "facts": [{"text": "Rockfall reported on path Z; suspension inspection required.", "scenario": 1}], "question": "Is path A still muddy?", "scenario": 0, "expect": {"first": ["data/paths.json#0/A", "data/paths.json#0/B", "data/paths.json#0/C"], "not_retrieved": ["fact-0"]}},
  {"id": "fact-overrides-closed-path", "tags": ["facts", "override", "arithmetic"], "facts": [{"text": "Path C is closed by a landslide and cannot be used.", "scenario": 0}], "question": "In which order should I take the paths to finish first?", "scenario": 0, "expect": {"first": ["data/paths.json#0/A", "data/paths.json#0/B", "data/paths.json#0/C", "fact-0"], "answer_contains": ["landslide", "6.0"]}},
  {"id": "fact-overrides-speed", "tags": ["facts", "override"], "facts": [{"text": "Floor heating on path R failed; it is now icy and average speed dropped to 1.0 km/h.", "scenario": 2}], "question": "Is path R still the easy one?", "scenario": 2, "expect": {"first": ["data/paths.json#2/P", "data/paths.json#2/Q", "data/paths.json#2/R", "fact-0"], "answer_contains": ["icy"]}},
  {"id": "fact-order-preserved", "tags": ["facts", "pinning"], "facts": [{"text": "Path P snow was cleared this morning.", "scenario": 2}, {"text": "Path Q ice patches have been salted.", "scenario": 2}], "question": "What changed on the winter paths?", "scenario": 2, "expect": {"first": ["data/paths.json#2/P", "data/paths.json#2/Q", "data/paths.json#2/R", "fact-0", "fact-1"]}},
  {"id": "fact-mixed-scenarios", "tags": ["facts", "pinning"], "facts": [{"text": "Path Y gravel was washed out by a storm.", "scenario": 1}, {"text": "Path A mud has dried out.", "scenario": 0}], "question": "Should I still avoid path A?", "scenario": 0, "expect": {"first": ["data/paths.json#0/A", "data/paths.json#0/B", "data/paths.json#0/C", "fact-1"], "not_retrieved": ["fact-0"]}},
  {"id": "fact-global-reaches-scenario", "tags": ["facts", "global"], "description": "A fact without scenario applies everywhere; it should reach a scenario question.", "facts": [{"text": "The whole forest is closed today for a hunting event.", "scenario": null}], "question": "Can I take path B now?", "scenario": 0, "expect": {"retrieved": ["fact-0"]}},
  {"id": "fact-global-pinned-without-scenario", "tags": ["facts", "global"], "facts": [{"text": "Battery packs were replaced; range is now 12 km.", "scenario": null}], "question": "What is the robot's range?", "scenario": null, "expect": {"first": ["fact-0"], "answer_contains": ["12"]}}
]
