[
  {"id": "retrieval-battery-paraphrase", "tags": ["retrieval", "manual"], "question": "How does the robot make sure it doesn't run out of battery?", "expect": {"retrieved": ["data/documents/sample_manual.md#1"]}, "xfail": "'battery' vs manual's 'power source'; example chunks outrank manual #1"},
  {"id": "retrieval-bad-weather", "tags": ["retrieval", "manual"], "question": "What does the robot do when a storm is coming?", "expect": {"retrieved": ["data/documents/sample_manual.md#3"]}, "xfail": "'storm' paraphrase misses manual #3; example chunks dominate top-6"},
  {"id": "retrieval-blocked-by-debris", "tags": ["retrieval", "manual"], "question": "What happens when a fallen trunk blocks its way?", "expect": {"retrieved": ["data/documents/sample_manual.md#4"]}, "xfail": "'fallen trunk' paraphrase misses manual #4"},
  {"id": "retrieval-human-takeover", "tags": ["retrieval", "manual"], "question": "Can an operator take over and force a different decision?", "expect": {"retrieved": ["data/documents/sample_manual.md#9"]}, "xfail": "'take over' vs 'human overrides' misses manual #9; no stemming in BM25"},
  {"id": "retrieval-learns-from-experience", "tags": ["retrieval", "manual"], "question": "Does the robot get better after each mission?", "expect": {"retrieved": ["data/documents/sample_manual.md#10"]}},
  {"id": "retrieval-self-check", "tags": ["retrieval", "manual"], "question": "Does the robot check its own health and keep logs?", "expect": {"retrieved": ["data/documents/sample_manual.md#12"]}},
  {"id": "retrieval-fragile-plants", "tags": ["retrieval", "manual"], "question": "How does it avoid harming wildlife and fragile plants?", "expect": {"retrieved": ["data/documents/sample_manual.md#18"]}},
  {"id": "retrieval-fog-sensor", "tags": ["retrieval", "manual"], "question": "What if the laser scanner gives bad readings in mist?", "expect": {"retrieved": ["data/documents/sample_manual.md#16"]}},
  {"id": "retrieval-tilt-detection", "tags": ["retrieval", "manual"], "question": "How does it notice it is about to tip over?", "expect": {"retrieved": ["data/documents/sample_manual.md#19"]}, "xfail": "'tip over' paraphrase misses manual #19 (tilt)"},
  {"id": "retrieval-time-of-day", "tags": ["retrieval", "manual"], "question": "Does the hour of the day change where it drives?", "expect": {"retrieved": ["data/documents/sample_manual.md#20"]}},
  {"id": "retrieval-swamps", "tags": ["retrieval", "manual"], "question": "How does it keep out of swamps and nature reserves?", "expect": {"retrieved": ["data/documents/sample_manual.md#15"]}},
  {"id": "retrieval-landslide", "tags": ["retrieval", "manual"], "question": "Why would it refuse a route where the hillside might collapse?", "expect": {"retrieved": ["data/documents/sample_manual.md#17"]}, "xfail": "'hillside collapse' paraphrase misses manual #17 (landslide)"},
  {"id": "retrieval-conflicting-data", "tags": ["retrieval", "manual", "example"], "question": "Old records and live sensors disagree: which one wins?", "expect": {"retrieved": ["data/documents/sample_manual.md#8", "data/explanations/sample_explanations.json#6"]}, "xfail": "example #6 found but manual #8 (data conflicts) missed"}
]
